{
  "schemaVersion": 1,
  "operationId": "59fb9e8c-7c4c-4d38-92f9-16903243d557",
  "command": "backup-schedules-status",
  "startedAt": "2026-07-29T23:18:05.192843Z",
  "completedAt": "2026-07-29T23:18:05.193312Z",
  "status": "success",
  "targets": [
    "node-1",
    "node-2",
    "node-3"
  ],
  "reason": null
}
