{
  "schemaVersion": 1,
  "operationId": "793eb871-1497-4608-b990-b69575028cf8",
  "command": "status",
  "startedAt": "2026-07-28T17:06:28.841690Z",
  "completedAt": "2026-07-28T17:06:28.842249Z",
  "status": "success",
  "targets": [
    "node-1",
    "node-2",
    "node-3"
  ],
  "reason": null
}
