{
  "schemaVersion": 1,
  "operationId": "3df57106-4f7b-482c-8ef2-d9034665ebf4",
  "command": "build",
  "startedAt": "2026-07-28T20:00:16.430401Z",
  "completedAt": "2026-07-28T20:00:16.430499Z",
  "status": "success",
  "targets": [
    "node-1",
    "node-2",
    "node-3"
  ],
  "reason": null
}
