{
  "schemaVersion": 1,
  "operationId": "c7e85384-ce89-4db6-b8db-a72b02fa0d5f",
  "command": "status",
  "startedAt": "2026-07-29T15:19:40.829199Z",
  "completedAt": "2026-07-29T15:19:40.829762Z",
  "status": "success",
  "targets": [
    "node-1",
    "node-2",
    "node-3"
  ],
  "reason": null
}
