{
  "schemaVersion": 1,
  "operationId": "c07d9926-2997-4812-9c1e-82fb170c9bab",
  "command": "backup-schedules-status",
  "startedAt": "2026-07-29T19:38:58.278398Z",
  "completedAt": "2026-07-29T19:38:58.278610Z",
  "status": "success",
  "targets": [
    "node-1",
    "node-2",
    "node-3"
  ],
  "reason": null
}
