{
  "schemaVersion": 1,
  "operationId": "ded1d240-ae65-4e84-b2b3-f24ec314ccad",
  "command": "status",
  "startedAt": "2026-07-28T22:21:15.438851Z",
  "completedAt": "2026-07-28T22:21:15.439193Z",
  "status": "success",
  "targets": [
    "node-1",
    "node-2",
    "node-3"
  ],
  "reason": null
}
